ANN/Classes/leelaz_opencl_tuning
0;XgemmBatched;384;256;384;16; -DKWG=32 -DKWI=2 -DMDIMA=8 -DMDIMC=8 -DMWG=64 -DNDIMB=8 -DNDIMC=8 -DNWG=64 -DSA=0 -DSB=0 -DSTRM=0 -DSTRN=0 -DVWM=4 -DVWN=2;OpenCL: NVIDIA Corporation GeForce RTX 2080 @ 1815MHz
